{
  "subject": "agentreg:example.org:agent-123",
  "requested_time": "2026-07-15T10:00:00Z",
  "evaluation_time": "2026-08-11T03:00:00Z",
  "state_at_requested_time": {
    "agent_id": "agentreg:example.org:agent-123",
    "registration": "active",
    "operation": "available",
    "authority": "valid",
    "assurance": "valid",
    "security": "normal",
    "effective_at": "2026-07-15T10:00:00Z",
    "observed_at": "2026-07-15T10:00:00Z",
    "valid_until": "2026-12-31T23:59:59Z",
    "source": "registry.example.org"
  },
  "current_state": {
    "agent_id": "agentreg:example.org:agent-123",
    "registration": "active",
    "operation": "available",
    "authority": "valid",
    "assurance": "valid",
    "security": "normal",
    "effective_at": "2026-07-18T09:30:00Z",
    "observed_at": "2026-08-11T03:00:00Z",
    "valid_until": "2026-12-31T23:59:59Z",
    "source": "registry.example.org"
  },
  "reconstruction_status": "indeterminate",
  "selected_records": [],
  "event_checkpoint": null,
  "later_material_events": [
    {
      "event_type": "status_change",
      "effective_at": "2026-07-18T09:30:00Z",
      "historical_effect": "indeterminate",
      "reason_code": null,
      "evidence_reference": "evidence:event:42"
    }
  ],
  "historical_effect": "indeterminate",
  "retention": {
    "evidence_available": false,
    "status": "outside_retention",
    "boundary": "2026-07-01T00:00:00Z"
  },
  "evidence": {
    "references": [],
    "integrity_status": "not_available",
    "lineage_mechanism": null
  },
  "warnings": []
}
